Position,Company,Location,URL
연합인포맥스 R&D개발 신입/경력 (전문연구요원 포함) ~12/12(월) 마감의 전체 세부 정보,연합인포맥스,서울 종로구,https://kr.indeed.com/rc/clk?jk=4d9cd85b61754c6a&fccid=c0cba40e6676323a&vjs=3
Front-end Developer의 전체 세부 정보,크래프트테크놀로지스,서울 영등포구,https://kr.indeed.com/rc/clk?jk=baac449478aa1d96&fccid=2775f62c77fd9b9e&vjs=3
웹 프론트엔드 엔지니어의 전체 세부 정보,뱅크샐러드,서울 영등포구,https://kr.indeed.com/rc/clk?jk=8a69b59eaffabb56&fccid=35209469e1b8c72c&vjs=3
[위메프서비스] 프론트엔드 개발자의 전체 세부 정보,위메프,대한민국,https://kr.indeed.com/rc/clk?jk=cd4215f2e3c50f03&fccid=2f8799a5ef214646&vjs=3
Pala Backend engineer 경력 정규직의 전체 세부 정보,팔라,성남 분당구,https://kr.indeed.com/rc/clk?jk=a86294dbdeecdf94&fccid=62086f4e9fd74de9&vjs=3
R&D 개발 신입/경력 채용의 전체 세부 정보,연합인포맥스,서울 수송동,https://kr.indeed.com/rc/clk?jk=0cfc2422605971cc&fccid=c0cba40e6676323a&vjs=3
[캐치시큐] CTO (경력/10년 이상)의 전체 세부 정보,오내피플,서울 마포구,https://kr.indeed.com/rc/clk?jk=ffeacdbf4c331f78&fccid=a577057f99236d62&vjs=3
[EY한영] 세무본부 PAS 팀 IT 개발 담당 채용의 전체 세부 정보,EY,서울 영등포구,https://kr.indeed.com/rc/clk?jk=d1d73f31350f210c&fccid=1544766d4c2915b0&vjs=3
